filename,page number,page text
Anale fissuur,page_1,"Title: Wat kunt u zelf doen om een anale fissuur te voorkomen?
Om anale fissuren te voorkomen en de genezing te bevorderen, is het belangrijk om te zorgen dat uw ontlasting zacht en soepel is. Als uw ontlasting zacht is hoeft u meestal niet hard te persen om de ontlasting kwijt te raken en kan het slijmvlies minder snel beschadigen. De kans dat fissuren ontstaan is dan klein en bestaande fissuren krijgen de kans om te genezen. Tips en adviezen om de ontlasting zacht te houden: 
- Eet vezelrijk. Vezels zijn onverteerbare voedingsdeeltjes afkomstig uit plantaardige voeding. Vezels zorgen voor een goede darmwerking en nemen daarnaast vocht op in de ontlasting. Hierdoor wordt de ontlasting zacht en soepel. Voor extra informatie zie folder ‘Vezelverrijkte voeding’. 
- Drink dagelijks ten minste 1½ tot 2 liter vocht. Hiermee kunt u voorkomen dat de ontlasting uitdroogt. 
- Beweeg voldoende. Dagelijks bewegen zorgt ervoor dat de darm in beweging blijft. Te weinig bewegen kan verstopping veroorzaken of verergeren. 
- Eventueel kunt u middelen/medicijnen gebruiken die de ontlasting zachter maken. Wanneer u last heeft van verkramping of verhoogde spanning van de kringspier kan een warm bad verlichting bieden. Als u moeite heeft de bekkenbodemspieren te ontspannen zou bekkenbodemtherapie kunnen helpen. De bekkenbodem is de spiergroep die ervoor zorgt dat wij ontlasting en urine kunnen ophouden en dat we ontlasting en urine kwijt kunnen raken indien we dat willen.

Title: Wanneer is verdere behandeling nodig?
Wanneer ondanks het nemen van bovengenoemde maatregelen en leefregels de klachten toch voortduren, is verdere behandeling aangewezen."
"Ondervoeding, voedingsadviezen bij (risico op)",page_0,"Title: Voedingsadviezen bij (risico op) ondervoeding
Bij opname in het ziekenhuis zijn vragen over uw voedingstoestand gesteld. Uit deze vragen is gebleken dat er bij u sprake is van (risico op) ondervoeding. Om die reden krijgt u deze folder en wordt er tijdens uw ziekenhuisopname een energie- en eiwitrijk dieet aangeboden met drie keer per dag een energie- en eiwitrijk tussendoortje. U kunt hiervoor samen met de zorgassistent een keuze maken van de menukaart.

Title: Inleiding
Een energie- en eiwitverrijkt dieet is bestemd voor mensen met een te laag lichaamsgewicht of bij wie sprake is van onbedoeld gewichtsverlies. Een energie- en eiwitverrijkt dieet wordt bijvoorbeeld geadviseerd wanneer u: 
- Langdurig ziek bent. 
- Een zware operatie moet of heeft ondergaan. 
- Grote operatie- of doorligwonden heeft. 
- Ondergewicht heeft. 
- Onbedoeld bent afgevallen. 
- Bestraling en/of chemotherapie moet ondergaan. Bij ziekte en herstel (bijvoorbeeld na een operatie) verbruikt het lichaam meer energie (= calorieën) en eiwit (=bouwstof voor onder andere de spieren) dan normaal. Eiwit komt veel voor in: vlees, vis, kaas, ei, (soja)melkproducten, noten, pinda’s en peulvruchten. Door bijvoorbeeld verminderde eetlust, misselijkheid, emoties en benauwdheid is eten vaak moeilijk, waardoor de inname aan voedingsstoffen minder kan worden. Als u onbedoeld gewicht verliest, verliest u geen vetreserves maar spiermassa. Verlies van spiermassa is niet wenselijk en heeft nadelige gevolgen voor uw conditie.

Title: Tijdens opname
Tijdens uw opname krijgt u een menukaart met energie- en eiwitrijk dieet. Hierbij krijgt u drie keer per dag een energie- en eiwitrijk tussendoortje aangeboden. Indien nodig wordt er op de vierde opnamedag bijgehouden wat u eet en drinkt. Door de diëtist wordt gekeken of dit voldoende voor u is.

Title: Energie- en eiwitrijke tussendoortjes tijdens opname
Product Eenheid Eiwit Kcal Melkunie Protein Shake 225 ml 20 170 Energie- en eiwitverrijkte vla 150 ml 11 213 Energie- en eiwitverrijkte pap 150 ml 10 242 Vruchtenkwark 150 ml 10 180 Roomyoghurt 150 ml 5 225 Bouwsteentje 1 stuks 10 200 Easy to eat 1 stuks 11 150 Roomijs 100 ml 3 220 Rundvleessalade 150 gram 5 240 Salade (ei of zalm) 50 gram 5 150 - 200 Kaasblokje 40 gram 10 150 Eiwitverrijkte fruitdrink 150 ml 10 110 Appel/blauwe bes of sinaasappel Eiwitverrijkte tomatensoep Bifi worstje Petit maaltijd Kipgehaktbal, aardappel, asperges Spaghetti bolognese (vegetarisch) 150 ml 40 gram 125 gram 10 4 10 105 150 180

Title: Wanneer u naar huis gaat
Ook thuis is het nog steeds belangrijk om voldoende te eten en te drinken. In deze folder worden adviezen gegeven hoe u de voeding energie- en eiwitrijker kunt maken."
Kaliumbeperkt dieet,page_0,"Title: Kaliumbeperkt dieet
In deze folder vindt u meer informatie over kalium en het kaliumbeperkt dieet.

Title: Wat is kalium?
Kalium is een mineraal dat een rol speelt bij belangrijke lichaamsfuncties. In het lichaam zorgen de nieren ervoor dat de hoeveelheid kalium in uw lichaam in balans blijft. Als uw nieren minder goed werken of als u bepaalde medicatie gebruikt (zoals plastabletten of zogenoemde ACE-remmers), kan het zijn dat er teveel kalium in het lichaam achterblijft. In dat geval is het nodig om de hoeveelheid kalium in uw voeding te beperken. Kalium is een mineraal dat in vrijwel alle voedingsmiddelen voorkomt. Als u het advies krijgt om het kalium te beperken in uw voeding, is het verstandig om vooral de voedingsmiddelen waar veel kalium in zit te verminderen. Helaas wordt de hoeveelheid kalium vaak niet vermeld op de verpakking van een voedingsmiddel. Met de informatie in deze folder willen wij u hier inzicht in geven. Kalium zit veel in melk en melkproducten, aardappelen, groenten, fruit, gedroogde vruchten, vruchtensappen, tomaat, cacao/chocolade, peulvruchten, koffie en noten. Weinig tot geen kalium zit in thee, rijst, pasta, frisdrank, kaas, olie, jam, suiker en honing.

Title: Algemene adviezen
In deze alinea leest u algemene adviezen voor een kaliumbeperkt dieet. Bereidingswijze van eten Bij het roerbakken, stomen of smoren van groenten en aardappelen treedt weinig kaliumverlies op. Als u bij deze groenten rijst of pasta neemt, waar vrijwel geen kalium in zit, krijgt u bij de totale warme maaltijd toch iets minder kalium binnen dan wanneer u hier aardappelen bij eet. Bij het koken van groenten en aardappelen in water gaat ongeveer een derde deel van het kalium verloren als ze gesneden zijn en in een ruime hoeveelheid water gekookt worden (gebruik het kookvocht dan niet voor bijvoorbeeld het aanlengen van een sausje of jus). Stamppot Bij stamppot eet u over het algemeen meer aardappelen en groenten dan wanneer u de aardappelen naast de groenten eet. Een tip om uw kaliuminname van die dag toch te beperken, is om die dag andere kaliumrijke voedingsmiddelen te laten staan en/of de dag erna rijst of pasta te eten in plaats van aardappelen. Patat Een portie patat bevat veel meer kalium als eenzelfde portie gekookte aardappelen. Eet daarom liever niet te vaak patat. Als u toch patat eet, kunt u ook hier uw kaliuminname van die dag en de dag erna beperken door andere kaliumrijke voedingsmiddelen te laten staan. Groenten De ene groente bevat meer kalium dan de andere. Kaliumrijke groenten zijn bijvoorbeeld postelein, spinazie, bleekselderij of tuinbonen. Het is verstandig om af te wisselen in uw groentensoorten. Koffie Koffie is een kaliumrijke drank. Dit geldt voor alle koffiesoorten (filterkoffie, oploskoffie, Senseo koffie of koffie uit een luxe koffiemachine). Thee is een goede vervanger van koffie.

Title: Broodbeleg
De volgende soorten broodbeleg zijn kaliumrijk: chocoladepasta, chocoladehagelslag, appelstroop en pindakaas. Wissel deze soorten af met andere soorten broodbeleg."
Kaliumbeperkt dieet,page_1,"Title: Fruit
Twee stuks fruit per dag is voldoende om uw goede vitamines binnen te krijgen. Neem liever geen of zo min mogelijk vruchtensappen of gedroogde vruchten. Peulvruchten Peulvruchten zoals bruine of witte bonen, kapucijners, linzen of (split)erwten bevatten meer kalium dan groenten. Eet hier dus liever geen aardappelen bij, maar bijvoorbeeld rijst. Kalium als smaakmaker Kalium smaakt wat bitterder dan zout, maar wordt vaak gebruikt als vervangende smaakmaker voor natrium. Als u het advies heeft gekregen om alleen uw zoutgebruik te verminderen, kunt u deze vervangende voedingsmiddelen gebruiken. Maar als uw nieren minder goed werken of als u kaliumsparende medicijnen gebruikt, worden deze producten afgeraden. Overleg hierover met uw arts of diëtist. Voorbeelden van deze producten zijn natriumarm zout, natriumarm brood of natriumarme smaakmakers zoals natriumarme ketjap manis of natriumarme Aromat.

Title: Kaliumgetallen
Het advies is om het kalium in uw voeding te beperken tot 2000 tot 3000 mg per dag. Hieronder vindt u de kaliumgetallen van de meest voorkomende voedingsmiddelen en voedingsmiddelen die rijk zijn aan kalium. Afronding op 10-tallen in milligrammen (mg): Bron: Eten met plezier

Title: Broodmaaltijd Kalium (mg)
Brood (bruin, volkoren, wit), per snee 60 Luxe broodje (kadetje, puntje), per stuk 110 Beschuit, per stuk 20 Ontbijtkoek, per plak 30 Roggebrood (donker), per snee 110 Roggebrood (licht), per snee 60 Fruitontbijt, per glas 200 Cruesli, per eetlepel 50

Title: Broodbeleg Kalium (mg)
Kaas, 48+, voor één snee 20 Smeerkaas, 48+, voor één snee 10 Vleeswaren, gemiddeld, voor één snee 50 Rauwe ham, voor één snee 110 Ontbijtspek, voor één snee 30 Appelstroop, voor één snee 110 Hagelslag, gemiddeld, voor één snee 80 Pindakaas, voor één snee 120 Sandwichspread, voor één snee 20

Title: Zuivel Kalium (mg)
Melk, per glas (150 ml) 240 Karnemelk, per glas (150 ml) 210 Vla, per schaaltje (150 ml) 220 Yoghurt, per schaaltje (150 ml) 230 Chocolademelk, per glas (150 ml) 310 Kwark, per schaaltje (150 ml) 240 Sojamelk, per glas (150 ml) 120 Yoghurtdrank, per glas (150 ml) 180

Title: Fruit Kalium (mg)
Appel, zonder schil 120 Peer, zonder schil 160 Banaan 370 Druiven, 1 trosje 290 Frambozen, 1 schaaltje 230 Kersen, 1 schaaltje 400 Sinaasappel 210 Grapefruit 250

Title: Groenten/peulvruchten Kalium (mg)
Bloemkool, 1 opscheplepel 120 Courgette, 1 opscheplepel 160 Komkommer, 1 schaaltje 170 Paprika, 1 stuks 240 Andijvie rauw, 100 gram 250 Bleekselderij rauw, 1 stuks 190 Champignons, 100 gram 320 Broccoli, 1 opscheplepel 200 Witlof, opscheplepel 130 Peulvruchten, gemiddeld, 1 opscheplepel 230 Tomaat, 1 stuks 170"
Vezelrijke voeding,page_1,"Title: Vezelrijke voeding 
Bij een vezelverrijking is het goed te streven naar 30-40 gram vezels per dag. Als uw voeding te weinig vezels bevat dan is het advies om dit geleidelijk te gaan verhogen. Houdt u er rekening mee dat de darmen moeten wennen aan een grotere hoeveelheid vezels en vocht. Mogelijk heeft u in het begin last van winderigheid en een opgeblazen gevoel. Na een aantal weken zullen deze klachten afnemen en ervaart u het positieve effect van de vezelrijke voeding.

Title: Vocht
Bij vezelrijke voeding is extra vocht belangrijk. Streef naar minimaal twee liter vocht per dag. Deze hoeveelheid is te vergelijken met ongeveer 13 glazen of 16 kopjes per dag. Dit kan water, thee, koffie, bouillon, melkproducten of vruchtensap zijn. Als u te weinig drinkt, kunnen de vezels hun sponsachtige werking niet uitoefenen en werken ze averechts.

Title: Algemene richtlijnen
1. Gebruik voldoende vezels. 2. Drink voldoende vocht, tenminste twee liter per dag (tenzij uw arts anders adviseert). 3. Begin de dag met een stevig ontbijt. 4. Zorg voor een regelmatig eetpatroon, gebruik in ieder geval drie hoofdmaaltijden per dag. Sla geen maaltijden over. 5. Zorg voor voldoende lichaamsbeweging. Beweging zorgt voor een goede stoelgang. 6. Gun u zelf voldoende tijd om naar het toilet te gaan. 7. Neem geen laxeermiddelen/vezelpreparaten buiten medeweten van uw arts of diëtist. Indien uw specialist extra oplosbare vezels voorschrijft, meestal plantaardige psylliumvezels, neem ze dan in met een groot glas water. De darm zal hier eerst aan moeten wennen wat vaak een tijdelijke toename van buikklachten geeft, een opgeblazen gevoel of een verandering van het ontlastingspatroon. Neem vier weken vezels in op een vast tijdstip. Daarna ontstaat vaak een sterke verbetering van de ontlasting en minder ongemak in de buik. 8. Probeer bij chronische diarree niet bij elke aandrang naar de wc te lopen. Op deze manier traint u uw darmen weer toe tot een normale stoelgang.

Title: Vezelrijke voedingsmiddelen
- Volkoren- en roggebrood, bruin brood, vezelrijk knäckebröd en -beschuit, mueslibrood, krenten- en rozijnenbrood. 
- Muesli, ontbijtgranen, vezelrijke bindmiddelen bijvoorbeeld: havermout, gort, grutten, boekweit en tarwevlokken. 
- Aardappelen, zilvervliesrijst, volkoren pasta, zoals macaroni en spaghetti. 
- Peulvruchten (linzen, kapucijners, groene erwten, bruine en witte bonen en kidneybonen). 
- Groenten en fruit. 
- Gedroogde en geweekte zuidvruchten zoals: pruimen, abrikozen, krenten, rozijnen, tuttifrutti en vijgen. 
- Noten en pinda’s. Als extra toevoeging ter verhoging van het vezelgehalte in uw voeding, kunt u zemelen, lijnzaad of fibrex (=bietenvezel) gebruiken. Het advies is om gelijktijdig met het gebruik hiervan extra te drinken. Deze producten kunt u toevoegen aan: 
- Pap, vla, yoghurt, karnemelk en vruchtensap. 
- Puree. 
- Als bindmiddel in waterige groenten, bijvoorbeeld: spinazie, andijvie en witlof. 
- In plaats van beschuit voor het aanmaken van gehakt. 
- Als paneermeel."
Voedingsadviezen bij gebruik van niet-selectieve MAO-remmers,page_3,"Title: Sojaproducten en gefermenteerde sauzen
Fermenteren wil zeggen dat er veranderingen in een product plaatsvinden onder invloed van bacteriën, gisten of schimmels. Deze micro-organismen kunnen het eiwit uit de producten omzetten in tyramine, waardoor deze gefermenteerde producten niet onbeperkt gegeten kunnen worden. De wijze van fermenteren bepaalt hoeveel van onderstaande producten gebruikt kunnen worden. Wanneer u gaat eten in een Oosters restaurant, informeer dan naar het gebruik van ketjap en andere Oosterse sauzen.

Title: Niet toegestaan
Beperkt toegestaan Onbeperkt toegestaan  Worcestershiresaus  Tamari Tempeh (gefermenteerd sojaproduct), maximaal 100 gram per dag, mits vers en verpakt!  Tahoe  Tofu  Heldere, gele en rode woksaus  Overige gefermenteerde Oosterse (vis)sauzen, bruin woksausen Sojasaus (Ketjap) En producten die hierop lijken met mate (1 eetlepel per dag). Flesjes na openen maximaal drie maanden in koelkast bewaren. Alle andere dan genoemde producten waarin soja is verwerkt.

Title: Dranken en (na overleg specialist) alcoholische dranken
Er zijn theesoorten te koop met gezondheidsclaims, zoals: goed voor de bloeddruk, de stofwisseling, de stoelgang, om af te vallen, enz. Omdat onbekend is welke stoffen aan deze thee zijn toegevoegd, wordt geadviseerd deze niet te gebruiken. Zelfgemaakte advocaat (ook te koop in landwinkels) en tokkelroom zijn niet toegestaan omdat ze bestanddelen van rauwe eieren bevatten. Zware biersoorten bevatten meer gist. Gist bevat van nature veel tyramine. Mousserende wijnen zoals bijvoorbeeld champagne en prosecco zijn gemaakt met meer gist waardoor ze meer tyramine bevatten. Drink geen alcohol of in ieder geval niet meer dan één glas per dag*.

Title: Niet toegestaan 
Beperkt toegestaan Onbeperkt toegestaan  Marmite  Vetamite gistextract pasta  Tartex  Zoete en zoute drop maximaal 50 gram. Vanwege invloed op de bloeddruk (glycyrrhizinezuur)  Pindakaas  Jam  Hagelslag  Sandwichspread  Stroop  Reformartikelen zoals ginseng producten, Sint- janskruid  Zuurdesembrood  Vitaminepreparaten in dosering hoger dan ADH*  L-tryptofaan  Sportvoedingspreparaten met weipoeder/aminozuren  Producten met Probiotica  Dampo bij droge hoest  Otrivin en vergelijkbare neussprays die xylometazoline bevatten  Noten en pinda’s  Noodles instant in beker of zakje (met kruiden/groete/kip)  Sportrepen  Noga  Marsepein  Bouillon tabletten  Boemboe  Boter  Crème fraiche, kookroom en zure room

Title: Nagerechten
Alle zuivelproducten gemaakt van gepasteuriseerde melk bevatten, als ze vers zijn en goed gekoeld bewaard, geen tyramine. Melk(producten) kunt u na openen nog maximaal drie dagen gebruiken. Dit geldt ook voor koffiemelk. Zelfgemaakte tiramisu is een eiwitrijk product en wordt in tegenstelling tot fabrieksmatig gemaakte tiramisu in een niet gekoelde ruimte bereid."
Natriumbeperkt dieet,page_0,"Title: Natriumbeperkt dieet (2000-2400 mg natrium)
U heeft het advies gekregen om een natriumbeperkt dieet te volgen. In deze folder leest u wat dat betekent en waar u op moet letten.

Title: Natrium of zout
Natrium is een mineraal en komt van nature voor in bijna alle voedingsmiddelen. Het is een bestanddeel van keukenzout: 1 g zout (1000 mg) bevat 400 mg natrium.

Title: Waarom een natriumbeperkt dieet?
Natrium is een mineraal dat in het lichaam voorkomt, het kan niet worden gemist. Het speelt een belangrijke rol in de waterhuishouding van ons lichaam. Een natriumbeperkt dieet kunt u om verschillende redenen geadviseerd krijgen. Bijvoorbeeld bij een verminderde nierfunctie, een verhoogde bloeddruk (hypertensie), het vasthouden van vocht (oedeem), hartfalen, vanwege bepaalde medicatie of vanwege een noodzakelijke vochtbeperking.

Title: In welke voedingsmiddelen komt natrium voor?
Natrium zit van nature in vrijwel alle voedingsmiddelen. Zo bevatten aardappelen en groente die zonder toevoeging van zout gekookt worden, toch een geringe hoeveel- heid natrium. Verder wordt aan veel voedingsmiddelen door de fabrikant zout toegevoegd. Dit wordt voornamelijk om de smaak en conserverende werking gedaan. Het kan ook dat er gebruik gemaakt wordt van zout of zoute smaakmakers tijdens het koken en bereiden van maaltijden.

Title: Informatie op het etiket
Op het etiket van voorverpakte producten staat hoeveel natrium (Na) erin zit. Door etiketten te vergelijken, kunt u het product kiezen met het laagste natriumgehalte. Als op een etiket staat dat het product zoutloos is, dan zit er ook werkelijk geen zout in. Let wel dat natrium op het etiket vaak staat aangeduid per 100 ml of mg. Dit is veelal niet de hoeveelheid die gebruikt wordt.

Title: Voedingsmiddelen die veel natrium bevatten
Soepen, sauzen, kant-en-klaar maaltijden, bouillon(-blokjes), ketjap, strooiaroma, kruidenmengsels, vleeswaren zoals rauwe ham, worstsoorten en rookvlees, gekruid vlees, rookworst, hamburgers, kaas, haring, zoutjes, borrelnootjes, snacks zoals bamiballen, frikadellen en kroketten.

Title: Natriumbeperkt dieet
U heeft het advies gekregen om een natriumbeperkt dieet te volgen. Bij een natriumbeperkt dieet is het de bedoeling dat uw voeding niet meer dan 2000-2400 mg natrium (= 5 a 6 gram zout) per dag bevat. Dit is de totale hoeveelheid natrium die u per dag met het eten en drinken mag gebruiken. Door de warme maaltijd zonder zout te bereiden en zo min mogelijk gebruik te maken van producten die veel zout bevatten, kunt u uw natriuminname verlagen."
Gladgebonden vloeibaar dieet,page_1,"Title: Lichaamsgewicht
Uw gewicht kan na de operatie afnemen. Dit gebeurt vooral in de eerste dagen na de operatie. Om ongewenst gewichtsverlies tegen te gaan, kunt u: 
- vaker iets eten; 
- extra vet gebruiken door toevoeging van (slag)room, boter of margarine aan vla, pap, mixmaaltijd of soep; 
- extra suiker gebruiken in thee, koffie, yoghurt, vla en dergelijke. Ook kan een tekort aan ijzer ontstaan doordat u bepaalde producten niet kunt eten. Het gebruik van Ferro-rozenbottel-siroop (extra ijzer) kan hiervoor een oplossing zijn. Deze moet u niet gebruiken in combinatie met melkproducten omdat ijzer daardoor slechter wordt opgenomen. Wanneer u last heeft van verstopping, kunt u gebruik maken van Laxo-rozenbottelsiroop (laxerende werking). Wanneer u veel gewicht verliest, neem dan contact op met uw diëtist.

Title: Voorbeeld van een dagmenu
Ontbijt: 
- pap eventueel met suiker en/of room; 
- (karne)melk of chocolademelk; 
- thee of koffie eventueel met suiker en/of room. In de loop van de morgen: 
- glas vruchtensap bijvoorbeeld sinaasappelsap eventueel met suiker en/of room; 
- vla, yoghurt of kwark; 
- koffie eventueel met suiker en/of room. Lunch: 
- pap eventueel met suiker en/of room; 
- (karne)melk of chocolademelk. In de loop van de middag: 
- kwark of yoghurt met rozenbottelsiroop en suiker; 
- thee eventueel met suiker . Warme maaltijd: 
- gezeefde mixsoep; 
- vruchtenmoes, appelmoes; 
- vla, yoghurt of kwark. In de loop van de avond: 
- koffie of thee eventueel met suiker en /of room; 
- milkshake.

Title: Voorbeelden voor milkshake
1. yoghurt met rozenbottelsiroop en roomijs, mixen. 2. karnemelk met sinaasappelsap, mixen en zeven. 3. kwark met slagroom en vanillevla, mixen en verdunnen. 4. vanillevla met limonadesiroop en yoghurt, mixen.

Title: Vragen
Heeft u na het lezen van deze folder nog vragen? Neem dan gerust contact op met de diëtist. Zij wil uw vragen graag beantwoorden. Afdeling diëtetiek ZGT Telefoonnummer: 088 708 32 20 Bereikbaar op werkdagen van 8.30 – 12.30 uur. E-mail: dietisten@zgt.nl

Title: Check uw dossier op MijnZGT
MijnZGT is het patiëntenportaal van ZGT. U kunt op MijnZGT via uw computer, tablet of mobiel delen van uw medisch dossier inzien, persoonlijke gegevens checken, of bijvoorbeeld vragenlijsten invullen die wij voor u hebben klaargezet. Kijk voor meer informatie op: zgt.nl/mijnzgt."
FDG PET-CT met Koolhydraatvrij-voorbereidingsdieet,page_3,"Title: Het voorbereidingsdieet (de dag voor het onderzoek):
De voeding die u gebruikt dient zo koolhydraatvrij mogelijk te zijn. Koolhydraten is de verzamelnaam voor alle vormen van suiker in de voeding zoals vruchtensuiker, melksuiker, zetmeel en de suiker uit de suikerpot en snoepjes. Op deze dag dient u minimaal 1 liter water extra te drinken! Hieronder volgt een overzicht van wat toegestaan is en wat niet: Toegestaan: 
- Heldere soep of bouillon (zonder vermicelli, rijst, noedels of ander bindmiddel) 
- Vlees, vis of kip (behalve gepaneerd vlees, worst en gehakt, slavinken en dergelijke) 
- Eieren 
- Kaas 
- Roomboter, margarine, halvarine 
- Koffie en thee zonder melk en suiker (geen oploskoffie van zakjes/ poeder, zoals cappuccino) 
- Light-frisdrank (let op: Dubbelfriss-light, Spa&Fruit-light en eigenmerk varianten zijn niet zonder koolhydraten!) 
- Diaran (= suikervrije ranja) 
- Water, mineraalwater Niet Toegestaan: 
- Alle broodsoorten, crackers, beschuiten 
- Zoetbeleg (zoals jam, hagelslag, stroop, honing en dergelijke) 
- Gepaneerd vlees, worst en gehakt, slavinken en dergelijke 
- Aardappelen, frites 
- Peulvruchten (bruine bonen, kapucijners en dergelijke) 
- Rijst 
- Pasta (macaroni, spaghetti en dergelijke) 
- Mie, miehoen 
- Meelproducten 
- Noten, pinda’s en dergelijke 
- Groenten, rauwkost 
- Fruit 
- Alle vruchtensappen 
- Melk, karnemelk en alle andere melkproducten 
- (Vruchten)yoghurt, vla, pudding en pap 
- Roomijs, waterijs en andere soorten ijs 
- Suiker 
- Alle snoep 
- Alle koekjes, ontbijtkoek 
- Chips 
- Frisdrank, ranja, Roosvicee, Diksap en dergelijke 
- Alcoholische dranken Als u twijfelt of een product koolhydraten bevat kunt u dit altijd terugvinden op de ingrediëntendeclaratie op de verpakking. U kunt dit terugvinden onder koolhydraten of suikers.

Title: Voorbeelddagmenu
Ontbijt Een kop bouillon Een gekookt ei (eventueel met wat zout) Een plakje vleeswaren en/of kaas Thee of koffie zonder melk en suiker, water of mineraalwater In de loop van de ochtend Thee of koffie zonder melk en suiker, water of mineraalwater Middageten Gekookt ei (of bijvoorbeeld een gebakken ei of roerei (zonder melk) met bacon en kruiden) Een plakje vleeswaren en/of kaas Thee of koffie zonder melk en suiker, water of mineraalwater In de loop van de middag Thee of koffie zonder melk en suiker, water of mineraalwater, frisdrank-light naar wens Avond eten Bouillon Stukje vlees, vis of kip (ongepaneerd) eventueel met zout, peper en kruiden Jus (alleen van bak- en braadvet of olie, zonder pakjes of bindmiddel) In de loop van de avond Thee of koffie zonder melk en suiker, water of mineraalwater, frisdrank-light naar wens Extra: Minimaal 1 liter water extra drinken Let op de tijd van het onderzoek: 4 uur voor de PET-scan moet u nuchter blijven!"
