topic_id,filename,header,section_text
9,Peelings (ZGT Helon),Werking van peelings,"Ongeacht de ingrediënten, zorgt een peeling altijd voor exfoliatie. Exfoliatie is het verweken van de bovenste laag huidcellen waardoor deze sneller gaat afschilferen. De huid wordt gestimuleerd om nieuwe, gezonde cellen aan te maken met tot gevolg een gladdere, egalere en beter gehydrateerde huid. Doordat elke peeling zijn specifieke eigenschappen heeft, is voor elk huidtype een geschikte peeling in te zetten. Zo zijn er peelings die pigmentvlekken oplichten, de talgproductie remmen, ontstekingen verminderen of de aanmaak van bindweefselvezels stimuleren."
9,Verwijderen permanente make-up (ZGT Helon),Doet het pijn?,Het verwijderen van permanente make-up gebeurt meestal zonder verdoving. Het voelt als korte speldenprikjes in de huid en kan gevoelig of pijnlijk zijn. Bij de pigmentlaserbehandeling mag de huid eventueel oppervlakkig verdoofd worden met een verdovende crème (Emla®). Bij de whipe off methode mag dit helaas niet.
9,Methyldibromoglutaronitril,Hoe vermijd ik het?,"Kies producten die vrij zijn van MDGN. Let op dat uw partner deze producten niet overbrengt op u zelf, bv via huidcontact. Het kan wel 3 weken duren voordat er verbetering begint op te treden nadat gestart is met het vermijden van het allergeen."
10,NO (stikstofmonoxide) meting,De meting,De longfunctieanalist vraagt u om in het meetapparaat na een volledige uitademing zo diep mogelijk in te ademen en met een constante snelheid gedurende 10 seconden weer uit te ademen.
10,Vliegen met gips,Patiënten informatie,‘vliegen met gipsverband’ U heeft gips om uw arm en/of been en u bent van plan om een vliegreis te gaan maken. In deze folder leest u over de voorbereidingen die nodig zijn wanneer u op reis gaat met het vliegtuig.
10,Spirografie en bodyplethysmografie met reversibiliteit,Bodyplethysmografie,Bij dit onderzoek wordt de weerstand over uw luchtwegen gemeten en de totale longinhoud bepaald. De deur van de cabine wordt tijdens deze oefening een korte tijd dicht gedaan. U kunt de deur van de binnenkant open maken. De longfunctieanalist vertelt u hoe u dat kunt doen. U wordt gevraagd om ongeveer een minuut normaal te ademen. Daarna mag u kort tegen een klepje in- en uitademen. Vervolgens vraagt de analist u om maximaal uit en in te ademen.
10,Spirografie en residubepaling zonder medicatie,Residubepaling,"Bij dit onderzoek wordt uw totale longinhoud gemeten. Tijdens deze test ademt u ongeveer drie minuten rustig door het mondstuk. U wordt een paar keer gevraagd om maximaal uit te ademen en maximaal in te ademen. Meldt u vooraf aan de longfunctieanalist(e) of u buisjes of gaatjes heeft in uw trommelvlies, dit kan namelijk van invloed zijn op de meting."
10,Zuurstof thuis,Onderhoud van het zuurstofapparaat,Eenmaal per jaar komt iemand van de zuurstofleverancier bij u langs voor controle en onderhoud van het apparaat. De leverancier neemt hiervoor zelf contact met u op.
10,Operaties aan het oor,Wat voor soorten ooroperaties zijn er?,"Wanneer de gehoorgang te nauw is, dan kan deze met een operatie wijder gemaakt worden. Het merendeel van de ooroperaties betreft operaties aan trommelvlies en middenoor. In het algemeen wordt hierbij het oor geopend via een snede achter de oorschelp. Uit de hierboven genoemde redenen om te opereren heeft u wellicht al begrepen, dat grofweg een onderscheid gemaakt kan worden in twee typen operaties: sanerende operaties en gehoor verbeterende operaties. Sanerende ooroperatie Een zogenaamde sanerende operatie heeft als doel de aanwezige ontsteking of ingroei van de huid in het oor te verwijderen en op deze wijze te genezen. Vaak is het bij deze ingreep nodig om niet alleen het middenoor te openen, maar ook het daarachter gelegen deel van het schedelbot. Bij bepaalde ontstekingen is het bovendien gewenst om het oor, ook wanneer na de operatie geen klachten meer bestaan, na ongeveer een jaar opnieuw met een operatie te openen en te controleren. Gehoor verbeterende ooroperatie Een zogenaamde gehoor verbeterende operatie houdt in wat de naam al aangeeft: een operatie met de bedoeling het gehoor te verbeteren. Dit kan een trommelvliessluiting zijn, een herstel van de gehoorbeenketen, het gedeeltelijk vervangen van de vastzittende stijgbeugel, et cetera. In sommige gevallen zal daarbij gebruik gemaakt moeten worden van kunststofmateriaal. Gelukkig is het in veel gevallen mogelijk om tijdens dezelfde operatie, zowel de ontsteking te verwijderen als de oorzaak voor de slechthorendheid weg te nemen. In dat geval is de operatie dus zowel sanerend als gehoor verbeterend geweest."
10,Zuurstof thuis,Leverdag,"De zuurstofleverancier spreekt een vaste leverdag in de week met u af. Als er voor die tijd iets nodig is, kunt u altijd bellen met de zuurstofleverancier. U krijgt een telefoonnummer dat 7 dagen in de week en 24 uur per dag bereikbaar is."
10,Fietsinspanningsonderzoek met arteriele bloedgassen,Doel,Bij dit onderzoek wordt uw maximale inspanningsvermogen getest door middel van een fietstest.
10,Kijkoperatie in de borstholte,Mogelijke operaties:,"De thoracoscopische operatie bij spontane pneumothorax De zwakke plekken in de long zijn meestal te zien als blazen (bullae) op het longoppervlak. Deze bullae kunnen heel klein zijn, maar ook groot, tot zelfs bijna zo groot als de hele long. De bullae, vooral die lucht lekken, worden afgebonden of dicht geniet. Dit laatste gebeurt met een speciaal nietapparaat. Hierna wordt het longvlies dat aan de borstholte vastzit, ruw gemaakt of gedeeltelijk verwijderd. Bijna altijd wordt daarna ook nog talk achtergelaten in de borstholte. Daardoor kan de long na de operatie met de borstwand vergroeien, zodat later geen kans meer bestaat op luchtlekkage tussen de long en de borstholte. De thoracoscopische verwijdering van kleine goedaardige gezwellen Daarbij wordt het longweefsel rondom het gezwel met het boven genoemde nietapparaat afgeniet, waarna het weefsel kan worden verwijderd. De diagnostische thoracoscopie en 'open' longbiopsie Zoals bij de verwijdering van een gezwel, kan met een nietapparaat een stuk longweefsel worden verwijderd voor microscopisch onderzoek. Ook stukjes longvlies of lymfklier kunnen worden uitgenomen voor onderzoek. De thoracoscopische sympathectomie Hierbij wordt in het bovenste gedeelte van de borstholte de zenuwbaan opgezocht, die betrokken is bij de overmatige zweetproductie of met de vaatkramp te maken heeft. Er wordt een stukje van enkele centimeters verwijderd (afgeklipt of verschroeid) met het doel de symptomen te doen verdwijnen of verminderen. Het is goed er rekening mee te houden, dat wanneer de thoracoscopische ingreep technisch niet goed uitvoerbaar blijkt, er reden kan zijn om de thoracoscopische procedure te staken en aansluitend over te gaan op een 'normale' operatie voor uw probleem. Aan het eind van een thoracoscopische ingreep worden er soms een of twee slangetjes (drains) in de borstkas gebracht. Aan dit slangetje(s) wordt een afzuigsysteem bevestigd. Dit afzuigsysteem zorgt ervoor dat de long zich zo goed mogelijk kan ontplooien, waarbij lucht, wondvocht en bloed worden afgezogen. De luchtlekkage stopt meestal binnen twee tot vijf dagen. Wanneer de controle röntgenfoto goed is kan de drain worden verwijderd. Bij thoracoscopische ingrepen, waarbij nogal wat pijn na de operatie te verwachten is, wordt vaak een zeer dun slangetje in de rug (epiduraal katheter) aangebracht. Hier doorheen kunnen extra pijnstillende middelen worden gegeven. Na twee of drie dagen wordt dit slangetje verwijderd en krijgt u eenvoudige pijnstillers."
10,Spirografie en residubepaling zonder medicatie,Het onderzoek,Tijdens het onderzoek zit u op een stoel. U krijgt een mondstuk in de mond waarmee u verbonden bent met een longfunctieapparaat. Uw ademhaling wordt geregistreerd. U krijgt ook een neusklem op om te voorkomen dat lucht via de neus in- of uitgeademd kan worden.
10,NO (stikstofmonoxide) meting,NO-meting,Uw medisch specialist heeft u verwezen voor een NO-meting. Tijdens dit onderzoek wordt de hoeveelheid stikstofmonoxide (NO) in uw uitgeademde lucht gemeten.
11,Dikke darmonderzoek (klinisch),Ná het onderzoek,"- Na de maaltijd 2 tabletten bisacodyl (= 2 x 5 mg.) innemen. N.B. Wanneer het onderzoek 's middags plaatsvindt, mag u als ontbijt en om 11 uur een licht beboterde beschuit en een kopje thee gebruiken. De eerste dagen na het onderzoek kan de ontlasting wit van kleur zijn."
11,Neusschelpverkleining (coblatie),Voor de behandeling,"- U mag voor deze behandeling geen medicijnen gebruiken die uw bloed dunner maken, zoals bijvoorbeeld Sintrom, Ascal en Aspirine. Als u één van deze medicijnen gebruikt, vragen wij u dit ruim een week voor de behandeling te melden aan uw KNO-arts. Andere medicijnen kunt u gewoon doorgebruiken. 
- U hoeft voor deze behandeling niet nuchter te zijn. Dit betekent dat u gewoon kunt eten en drinken tot vlak voor de ingreep. Wel adviseren wij u om 24 uur voor de behandeling geen alcoholhoudende dranken te gebruiken. 
- Neem uw afspraakkaart mee."
11,LAR-Syndroom,Klachten en tips,"Hieronder staan de meest voorkomende klachten en wat u er zelf aan kan doen om de klachten te verminderen Vaak naar het toilet, wel 10 tot 15 keer per dag, ook ’s nachts. Dunnere ontlasting (soms waterdun) 
- Gebruik niet te veel cafeïne (koffie, zwarte thee, cola), deze stof versterkt de werking van de darm. 
- Drink niet meer dan 1,5 liter op een dag. Hiervan drinkt u ongeveer een halve liter water-gerelateerde dranken (zoals koffie, thee, bouillon), een halve liter verzuurde melkproducten (zoals karnemelk en yoghurt) en een halve liter andere dranken. 
- Vervang bij ernstige klachten de laatste halve liter door isotone-dranken, zoals sportdrank, ORS en kokoswater. Isotone- dranken worden sneller door het bloed opgenomen. 
- Eet vaker kleinere maaltijden (5 tot 6 keer per dag). 
- Sla geen maaltijden over, dit verergert de waterige ontlasting en de winderigheid. 
- Eet vezelrijke producten. De richtlijn is 30 tot 40 gram vezels per dag. Eet dus voldoende volkoren brood, fruit (maximaal 3 stuks) en groente. Vezels maken de ontlasting dikker. Eet eventueel vezelrijke producten bij uw drinken, bijvoorbeeld een volkoren biscuit, beschuitje of sneetje brood. 
- Eet zetmeelrijke producten, zoals aardappelen, peulvruchten en bananen. Zetmeel maakt de ontlasting dikker. 
- Stop met roken. Roken verhoogt de werking van de darm en zorgt voor winderigheid. In korte tijd (1,5 tot 2 uur) vaak achter elkaar naar het toilet moeten (clustering van ontlasting). Een sterke aandrang van ontlasting die moeilijk uit te stellen is 
- Volg de voedingstips die hierboven bij ‘Vaak naar het toilet moeten’ en ‘Dunnere ontlasting’ staan. 
- Vraag advies bij een arts of verpleegkundige als de klachten blijven. Ongewild verlies van ontlasting, waardoor de huid rondom de anus geïrriteerd kan raken 
- Maak na elke ontlasting de huid rond de anus schoon met water en een zacht washandje. Gebruik geen zeep of hard toiletpapier. 
- Bescherm de (geïrriteerde) huid rond de anus met sudocrème, bepanthen of zinkoxidezalf. Deze producten koopt u bij de drogist. Ongewilde winden laten, door minder controle over de sluitspier 
- Drink geen koolzuurhoudende dranken (fris met prik), die zorgen juist voor meer winderigheid en een opgeblazen gevoel. 
- Eet vaker kleinere maaltijden (5 tot 6 keer per dag). 
- Sla geen maaltijden over, dit verergert de waterige ontlasting en de winderigheid. 
- Kauw uw eten goed. 
- Eet rustig zonder veel te praten. 
- Stop met roken. Roken verhoogt de werking van de darm en zorgt voor winderigheid. 
- Algemene voedingsadviezen bij winderigheid te vinden op de site van het voedingscentrum.nl"
11,FDG PET-CT,Voorbereidingen op het onderzoek,"Om het onderzoek goed te laten verlopen is het belangrijk dat u onderstaande richtlijnen strikt opvolgt: 
- Het is noodzakelijk dat u 4 uur voor het onderzoek nuchter bent. Dit betekent dat u vier uur voor het onderzoek niets meer mag eten en drinken. Voorbeeld: stel dat u om 11.00 uur ’s morgens het onderzoek ondergaat, dan mag u vanaf 7.00 uur die ochtend niets meer eten en drinken. Als u diabetes heeft kan het zijn, dat u andere instructies krijgt. 
- Wel moet u 1 liter water drinken in het uur vóór aankomst op de afdeling, (dit kunt u thuis en/of onderweg doen). Dit mag niet aangelengd zijn met limonade, ranja of iets dergelijks. Voorbeeld: stel dat u om 10.00 uur de afspraak heeft, dan moet u om 9.00 uur beginnen met water drinken. 
- U kunt te allen tijden gebruik maken van het toilet, u hoeft uw plas niet op te houden. 
- Alle medicijnen mag u gerust innemen met water. 
- Vanaf 24 uur van te voren tot en met het onderzoek mag u geen zware lichamelijke inspanning hebben geleverd. 
- U mag tijdens het onderzoek geen metalen voorwerpen bij u hebben of kleding met metalen onderdelen dragen. Bijvoorbeeld sieraden, sleutels en een bh kunt u daarom beter thuis laten als dat mogelijk is. 
- Indien u begeleiding nodig hebt, verzoeken we u om maximaal één begeleider mee te nemen. Deze begeleider mag niet bij het onderzoek aanwezig zijn. Eventuele extra begeleiders worden verzocht om tijdens uw onderzoek bijvoorbeeld te wachten in het bezoekersrestaurant ‘Smaak’. Dit vragen wij u omdat de wachtruimte van de afdeling nucleaire geneeskunde niet zo groot is. 
- Een lage buitentemperatuur kan de beeldvorming nadelig beïnvloeden. Het is daarom belangrijk dat u het niet koud hebt. Er wordt sterk aangeraden om zich bij koud weer warm te kleden vóór het PET-onderzoek met name onderweg naar het ziekenhuis. Ook wanneer u het snel koud hebt is het aan te raden om u warm te kleden. Hoe gaat het onderzoek in zijn werk U wordt meegenomen naar een kamer waar u een infuus in de arm krijgt. Via dit infuus krijgt u een radioactieve vloeistof toegediend. Het duurt één uur voor de vloeistof voldoende is opgenomen in uw lichaam. In sommige gevallen is het noodzakelijk dat een plasmiddel wordt toegediend, hierdoor moet de vloeistof een half uur langer inwerken. Het is van belang, dat u zo stil mogelijk blijft liggen en niet praat. Dit is om ervoor te zorgen dat de vloeistof naar de juiste plaatsen in uw lichaam gaat en niet alleen naar de spieren. Na een half uur rusten wordt u gevraagd twee bekers water te drinken. Vlak voordat de scan gemaakt wordt, is het belangrijk dat u eerst op het toilet goed uitplast. Een volle blaas stoort namelijk de beoordeling van het onderzoek. Hierna wordt de scan gemaakt. Tijdens de scan mag u metaalvrije kleding aanhouden. Tip: neem een pyjama mee. Afhankelijk van de foto’s die gemaakt moeten worden kan het totale onderzoek (inclusief wachttijd) 2 tot 3 uur duren. Bijwerkingen De soort en de hoeveelheid straling die u bij dit onderzoek krijgt zijn niet nadelig voor u of de mensen in uw omgeving. De radioactieve vloeistof is snel weer uit uw lichaam verdwenen en u hoeft thuis geen bijzondere maatregelen te nemen. Van deze radioactieve vloeistof krijgt u geen overgevoeligheidsreacties, ook niet als u overgevoelig bent voor jodium of contrastmiddelen. Het kan zijn dat bij u een CT met contrastmiddel wordt uitgevoerd. Als u overgevoelig bent voor contrastvloeistof of last hebt van allergische reacties, wilt u dit dan vóór het onderzoek melden."
11,"Coloscopie met moviprep, voorbereiding onder narcose",Onderzoek gepland in de ochtend Dag van het onderzoek,"U mag niet meer eten. Tot twee uur voor het onderzoek mag u nog kleine hoeveelheden heldere vloeistoffen drinken bijvoorbeeld water, thee, ranja, appelsap, heldere frisdranken zonder koolzuur, bouillon. Het is de bedoeling dat de ontlasting een heldere, lichte, gele kleur heeft. Heeft u dat niet? Drink dan extra water tot maximaal twee uur voor het onderzoek. Dag vóór het onderzoek Ontbijt Wit brood met kaas of ham. Geen brood met pitjes of vezels. Alléén heldere dranken zoals water, thee, ranja, appelsap, bouillon en heldere frisdranken zonder koolzuur. Geen melkproducten en geen koffie. 09:00- 11:00 Neem één liter Moviprep in (voor gebruik zie instructies achterin deze folder) en drink één liter heldere vloeistoffen (bijvoorbeeld water, thee, ranja, appelsap, heldere frisdranken zonder koolzuur, bouillon). Lunch Zie ontbijt. 17.00 Neem een lichte of helder vloeibare maaltijd, zoals een naturel beschuit en/of bouillon. 20.00- 22.00 Neem één liter Moviprep in en drink één liter heldere vloeistoffen (bijvoorbeeld water, thee, ranja, appelsap, heldere frisdranken zonder koolzuur, bouillon). Vanaf nu tot na het onderzoek mag u geen vast voedsel meer innemen. Na 22.00 uur Door de Moviprep krijgt u flinke diarree. Dit is hinderlijk voor u maar noodzakelijk voor het onderzoek. U mag bovenstaande heldere vloeistoffen gebruiken. U mag niet meer roken. Voor het slapen gaan neemt u 2 tabletten bisacodyl."
11,"Tioguanine (Lanvis, Thiosix) bij IBD",Wanneer?,"Neem dit medicijn bij voorkeur in op een lege maag, dus tot een half uur voor of vanaf een uur na een maaltijd. Gelijktijdige inname met voedsel kan dit medicijn namelijk minder werkzaam maken."
11,PEG en PEG-J katheter,Voorbereiding,"- Op de dag van de PEG of PEG-J-plaatsing mag u vanaf ’s nachts 00:00 uur niet meer eten of drinken, ook geen sondevoeding. 
- Als het onderzoek ’s middags na 13.00 uur plaatsvindt mag u nog een licht ontbijt (een naturel beschuit met een kopje thee). U mag dit ontbijt nuttigen tot zes uur voor het onderzoek. U mag nog heldere dranken (thee, water) gebruiken tot twee uur voor het onderzoek 
- Vertel uw medisch/verpleegkundig specialist of u medicijnen gebruikt, allergisch bent, een longziekte hebt, zwanger bent of ooit aan de maag geopereerd bent. 
- U kunt uw medicijnen gewoon blijven innemen, tenzij anders met u is afgesproken. Zie onder ‘Medicatie’ op pagina vier. 
- De maag-, darm- en leverarts voert de ingreep uit. U krijgt een infuus in uw arm. Via dit infuus krijgt u eerst antibiotica toegediend, later de sedatie."
11,Moviprep voorbereiding,Dag van het onderzoek,"6.00 – 8.00 uur Neem één liter Moviprep in en drink één liter heldere vloeistoffen. U mag nog tot twee uur voor het onderzoek heldere vloeistoffen blijven gebruiken, daarna nuchter. Desnoods moeten de tijden van inname van de Moviprep hierbij vervroegd worden. Als het onderzoek in de middag plaatsvindt dan mag u om 07.30 nog een licht ontbijt, (naturel beschuit met een kopje thee). U mag dan tussen 8.00 uur en 10.00 uur de liter Moviprep en de liter heldere vloeistoffen drinken. U mag nog tot twee uur voor het onderzoek heldere vloeistoffen blijven gebruiken. Het is de bedoeling dat uw ontlasting een heldere, licht gele, kleur heeft. Mocht dit niet zo zijn dan is het aan te raden extra water te drinken, tot maximaal twee uur voor het onderzoek."
13,Hydroxychloroquine,Mogelijke bijwerkingen,"Bijwerkingen kunnen optreden. Meest voorkomend 
- Verminderde eetlust. Soms/zelden voorkomend 
- Maag- en darmklachten, zoals een vol gevoel, misselijkheid, braken of diarree. 
- Huiduitslag en jeuk. 
- Hoofdpijn, duizeligheid, oorsuizen, slapeloosheid of juist sufheid. 
- Overgevoeligheid voor zonlicht. 
- Problemen met de ogen, zoals nachtblindheid, dubbel of wazig zien, het zien van lichtflitsen of kringen rondom lichtbronnen (‘s avonds)."
13,Coma hepaticum,Coma,"Coma is een toestand van diepe bewusteloosheid waaruit iemand niet kan worden wakker gemaakt. Het kan meerdere oorzaken hebben, zoals een forse klap op de schedel, te hoge of te lage bloedsuikers, of alcoholmisbruik. Levercoma is een coma dat wordt veroorzaakt door een falende lever. Bepaalde schadelijke stoffen die normaal gesproken door de lever uit het bloed verwijderd worden, bereiken nu de hersenen en beschadigen deze. Dit wordt ook wel encefalopathie genoemd; aantasting van de hersenfuncties."
13,Coma hepaticum,Oorzaken waardoor de HE plotseling kan,"verslechteren 
- uitdroging bijvoorbeeld bij braken, diarree of teveel gebruik van vocht afdrijvende medicijnen (diuretica zoals Furosemide, Spironolacton en Bumetanide); 
- gebruik van kalmerende middelen of zwaardere pijnstillers (slaapmiddelen of opiaten); 
- een bloeding in het maag-darmkanaal (dit veroorzaakt een groot aanbod van eiwitten in de darm); 
- verslechtering van de nierfunctie; 
- trage dikke darm functie (obstipatie); 
- een onderliggende infectie of ontsteking (waardoor meer ammoniak wordt aangemaakt in de darm)."
13,Iontoforese (Nocepta),Risico’s of bijwerkingen,"Ernstige complicaties komen zelden voor. Wel zijn er enkele mogelijke bijwerkingen welke na een iontoforesebehandeling kunnen optreden: 
- Vermoeidheid 
- Duizeligheid 
- Droge mond/neusslijmvlies 
- Gebrek aan eetlust 
- Wazig zien (visusstoornissen) 
- Een onbehagelijk gevoel rond de maagstreek/een misselijk gevoel 
- Roodheid van de huid op de plaats waar de pleister-electroden hebben gezeten 
- Een brandwond van de huid op de plaats waar de medicijnenpleister heeft gezeten"
13,Allopurinol,Mogelijke bijwerkingen allopurinol,"Bijwerkingen kunnen optreden. Meest voorkomend 
- Maag-darmklachten zoals een vol gevoel, misselijkheid en braken, of diarree. Dit kan verminderen door de tabletten in te nemen na de maaltijd. 
- Allergische huidreacties. Stop de allopurinol in dat geval. Soms/zelden voorkomend 
- Verminderde aanmaak van bloedcellen. 
- Verstoring van de lever werking. 
- Ernstige overgevoeligheidsreacties."
13,Borstoperatie met prothese,Bijwerkingen,"Bijwerkingen kunnen zijn: irritatie van het neusslijmvlies, jeuk, branderigheid, prikkelende pijn en roodheid."
13,Bekkenbodem problemen bij de vrouw,Klachten met ontlasting,"Er zijn verschillende klachten die met de ontlasting te maken hebben, zoals: 
- verlies van ontlasting; 
- hevige aandrang voor ontlasting, niet kunnen uitstellen; 
- het niet kunnen ophouden van windjes; 
- obstipatie; 
- ontlasting niet goed kwijtraken; 
- loze aandrang; 
- jeuk bij de anus."
13,Functionele maagklachten,Klachten bij functionele maagklachten,"- Pijn in de bovenbuik; 
- Misselijkheid; 
- Opboeren en oprispingen; 
- Een opgeblazen gevoel; 
- Snel een vol gevoel hebben; 
- Vieze smaak in de mond/slechte adem; 
- Bij bukken of liggen terugstromen van het maagzuur; 
- Soms braken."
13,Pericarditis,Oorzaken,"Oorzaken van pericarditis kunnen zijn: 
- virusinfectie, bijvoorbeeld na griep of verkoudheid (meestal); 
- een open hartoperatie; 
- een hartinfarct; 
- bacteriële infectie (zeldzaam); 
- borstkas trauma (ongeval); 
- kwaadaardige aandoeningen; 
- soms blijft de oorzaak onbekend."
14,Clioquinol,Wat zijn de verschijnselen bij een clioquinol allergie?,"Clioquinol overgevoeligheid laat een allergische contact dermatitis zien. De kwaal waarvoor het middel gebruikt wordt laat dan geen verbetering, soms juist een verslechtering, zien. Er kan toegenomen irritatie optreden met roodheid, jeuk en een branderig gevoel rond het geïnfecteerde gebied."
14,Parabenen mix,Hoe kan ik een parabenen mix allergie vermijden?,"Zodra overgevoeligheid voor parabenen is vastgesteld, zou u moeten proberen producten die parabenen bevatten te vermijden. Dit kan lastig zijn, omdat het in erg veel producten wordt gebruikt. Lees de etiketten op producten zorgvuldig en controleer zo of er geen parabenen in verwerkt zijn. U kunt uw drogist of apotheker altijd naar een passend alternatief vragen. Houdt er rekening mee dat u een kruisreactie kunt krijgen met para-aminobezoic zuur en paraphenyleendiamine (o.a. in haarverf). Maak uw (huis)arts erop attent dat u allergisch bent voor parabenen."
14,Clioquinol,Hoe kan ik een clioquinol allergie vermijden?,"U moet het gebruik van alle crèmes/zalven die clioquinol (of een van de alternatieve namen) bevatten vermijden. Meld bij uw (huis)arts altijd het feit dat u allergisch bent voor clioquinol, zodat hij of zij een passend alternatief kan bieden wanneer dit nodig mocht zijn. Bij het kopen van producten die zonder recept verkrijgbaar zijn moet u uw apotheker er op attent maken dat u allergisch bent voor clioquinol. Zij moeten u dan een passend alternatief kunnen bieden."
14,Quaternium-15,Wat zijn de reacties bij een quaternium-15 allergie?,Individuen die reageren op quaternium-15 zijn gevoelig voor formaldehyde of hebben een specifieke gevoeligheid. Typische allergische contact dermatitis komt voor bij beide soorten van gevoeligheid. Positieve plakproef Hand dermatitis veroorzaakt door quaternium-15 in crème Gezichts- dermatitis veroorzaakt door crème
14,Acupunctuur  (Nocepta),Bijwerkingen en complicaties,"- Bloeduitstorting 
- Allergische reactie 
- Klaplong (uiterst zeldzaam en alleen bij bepaalde punten risico aanwezig) 
- Infectie (uiterst zeldzaam)"
14,Geurstoffen mix,Wat is geurstoffen mix en waar vind je het?,"Geurstoffen mix is een mengeling van 8 geuren, die gebruikt worden voor de allergie screening. Het zijn de 8 belangrijkste geuren die een allergie kunnen veroorzaken en ze worden voor veel producten gebruikt om hun geur- en smaak eigenschappen."
14,"Immunotherapie, informed consent",Bijwerkingen,"Vaak komt op de plaats van de injectie een jeukende zwelling en roodheid voor, die in de loop van enkele dagen weer verdwijnt. Meestal is dit alleen hinderlijk en niet ernstig. Zelden treedt een onmiddellijke ernstige allergische reactie op vlak na de injectie. Dit wordt anafylaxie genoemd. De kenmerken zijn: jeuk over het hele lichaam, rode zwelling van de huid, jeukende ogen, niezen, kortademigheid en bloeddrukdaling. Omdat deze reactie binnen een half uur na de injectie kan optreden, moeten we u verplichten om een half uur na de injectie te blijven wachten in de wachtkamer. Na dit half uur kunt u gerust en veilig de polikliniek allergologie verlaten. Zodra u merkt dat u klachten krijgt van huid, neus, ogen of longen of wanneer u zich niet lekker gaat voelen, moet u dit direct aan de arts, assistente of secretaresse melden. Effectieve onmiddellijke behandeling van deze reacties is dan nodig."
